[
  {
    "card_id": "proto-011",
    "country_iso3": "BRA",
    "country_name": "Brazil",
    "weight_in_country": 0.2,
    "age_band": "35-44",
    "sex": "female",
    "urban_rural": "rural",
    "income_or_consumption_ppp_band": "above_830_2021ppp",
    "education": {
      "highest": "none",
      "source": "UNESCO UIS educational attainment rates, population 25+ (EA.1T8 / EA.2T8 / EA.5T8)",
      "year": 2023
    },
    "occupation_class": {
      "class": "unpaid_care_or_outside_labour",
      "source": "ILO modelled estimates, Nov. 2025 (EAP_2WAP labour-force participation and UNE_2EAP unemployment)",
      "year": 2025
    },
    "family": {
      "household_size_band": "6+",
      "under_18_in_household": null,
      "source": "UN DESA Household Size and Composition 2026 (DYB: Brazil 2022 Census); person-weighted by band midpoint",
      "year": 2022
    },
    "housing_energy_water_internet": {
      "electricity": true,
      "at_least_basic_water": null,
      "at_least_basic_sanitation": null,
      "internet_user": null,
      "source_electricity": "World Bank WDI EG.ELC.ACCS.ZS (Global Electrification Database / Tracking SDG7)",
      "source_water": null,
      "source_sanitation": null,
      "source_internet": null,
      "year_electricity": 2024,
      "year_water": null,
      "year_sanitation": null,
      "year_internet": null
    },
    "health_disability": {
      "status": "unknown"
    },
    "religion": {
      "affiliation": "unknown",
      "license_ok": false
    },
    "sexuality_or_gender_minority": {
      "status": "unknown"
    },
    "country_hdi": {
      "value": 0.786,
      "year": 2023,
      "source": "UNDP Human Development Report 2025, hdi_2023"
    },
    "country_life_expectancy": {
      "years": 75.8482,
      "year": 2023,
      "source": "UN DESA World Population Prospects 2024, period e0 (LEx), both sexes"
    },
    "sources": [
      {
        "field": "age_band",
        "producer": "UN DESA Population Division, World Population Prospects 2024",
        "year": 2023,
        "url": "https://population.un.org/wpp/assets/Excel%20Files/1_Indicator%20(Standard)/CSV_FILES/WPP2024_PopulationBySingleAgeSex_Medium_1950-2023.csv.gz",
        "license": "CC BY 3.0 IGO"
      },
      {
        "field": "sex",
        "producer": "UN DESA Population Division, World Population Prospects 2024",
        "year": 2023,
        "url": "https://population.un.org/wpp/assets/Excel%20Files/1_Indicator%20(Standard)/CSV_FILES/WPP2024_PopulationBySingleAgeSex_Medium_1950-2023.csv.gz",
        "license": "CC BY 3.0 IGO"
      },
      {
        "field": "country_iso3",
        "producer": "UN DESA Population Division, World Population Prospects 2024",
        "year": 2024,
        "url": "https://population.un.org/wpp/assets/Excel%20Files/1_Indicator%20(Standard)/CSV_FILES/WPP2024_PopulationBySingleAgeSex_Medium_1950-2023.csv.gz",
        "license": "CC BY 3.0 IGO"
      },
      {
        "field": "urban_rural",
        "producer": "UN DESA Population Division, World Urbanization Prospects 2025 (DEGURBA)",
        "year": 2025,
        "url": "https://population.un.org/wup/assets/Download/Countries%20and%20Aggregates/WUP2025-F02-Degree-of-Urbanization_percPop_by_category.xlsx",
        "license": "CC BY 3.0 IGO"
      },
      {
        "field": "income_or_consumption_ppp_band",
        "producer": "World Bank PIP income survey (national, 2021 PPP $3 / $4.20 / $8.30)",
        "year": 2023,
        "url": "https://api.worldbank.org/pip/v1/pip?country=BRA&year=2023&povline=3&format=json",
        "license": "CC-BY 4.0"
      },
      {
        "field": "education",
        "producer": "UNESCO Institute for Statistics",
        "year": 2023,
        "url": "https://api.uis.unesco.org/api/public/data/indicators",
        "license": "CC BY-SA 4.0"
      },
      {
        "field": "occupation_class",
        "producer": "ILO / ILOSTAT modelled estimates, Nov. 2025",
        "year": 2025,
        "url": "https://rplumber.ilo.org/data/indicator/?id=EAP_2WAP_SEX_AGE_RT_A&type=label&format=.csv",
        "license": "CC BY 4.0"
      },
      {
        "field": "family",
        "producer": "UN DESA Population Division, Database on Household Size and Composition 2026",
        "year": 2022,
        "url": "https://population.un.org/Household/assets/UNDESA_PD_2026_hh-size-composition.xlsx",
        "license": "CC BY 3.0 IGO"
      },
      {
        "field": "housing_energy_water_internet.electricity",
        "producer": "World Bank WDI EG.ELC.ACCS.ZS",
        "year": 2024,
        "url": "https://api.worldbank.org/v2/country/all/indicator/EG.ELC.ACCS.ZS?format=json",
        "license": "CC BY-4.0"
      },
      {
        "field": "country_hdi",
        "producer": "UNDP Human Development Report Office, HDR 2025",
        "year": 2023,
        "url": "https://hdr.undp.org/sites/default/files/2025_HDR/HDR25_Composite_indices_complete_time_series.csv",
        "license": "CC BY 3.0 IGO"
      },
      {
        "field": "country_life_expectancy",
        "producer": "UN DESA Population Division, World Population Prospects 2024",
        "year": 2023,
        "url": "https://population.un.org/wpp/assets/Excel%20Files/1_Indicator%20(Standard)/CSV_FILES/WPP2024_Demographic_Indicators_Medium.csv.gz",
        "license": "CC BY 3.0 IGO"
      }
    ]
  },
  {
    "card_id": "proto-012",
    "country_iso3": "BRA",
    "country_name": "Brazil",
    "weight_in_country": 0.2,
    "age_band": "65-74",
    "sex": "female",
    "urban_rural": "urban",
    "income_or_consumption_ppp_band": "420_to_830_2021ppp",
    "education": {
      "highest": "tertiary",
      "source": "UNESCO UIS educational attainment rates, population 25+ (EA.1T8 / EA.2T8 / EA.5T8)",
      "year": 2023
    },
    "occupation_class": {
      "class": "unpaid_care_or_outside_labour",
      "source": "ILO modelled estimates, Nov. 2025 (EAP_2WAP labour-force participation and UNE_2EAP unemployment)",
      "year": 2025
    },
    "family": {
      "household_size_band": "2-3",
      "under_18_in_household": null,
      "source": "UN DESA Household Size and Composition 2026 (DYB: Brazil 2022 Census); person-weighted by band midpoint",
      "year": 2022
    },
    "housing_energy_water_internet": {
      "electricity": true,
      "at_least_basic_water": null,
      "at_least_basic_sanitation": null,
      "internet_user": null,
      "source_electricity": "World Bank WDI EG.ELC.ACCS.ZS (Global Electrification Database / Tracking SDG7)",
      "source_water": null,
      "source_sanitation": null,
      "source_internet": null,
      "year_electricity": 2024,
      "year_water": null,
      "year_sanitation": null,
      "year_internet": null
    },
    "health_disability": {
      "status": "unknown"
    },
    "religion": {
      "affiliation": "unknown",
      "license_ok": false
    },
    "sexuality_or_gender_minority": {
      "status": "unknown"
    },
    "country_hdi": {
      "value": 0.786,
      "year": 2023,
      "source": "UNDP Human Development Report 2025, hdi_2023"
    },
    "country_life_expectancy": {
      "years": 75.8482,
      "year": 2023,
      "source": "UN DESA World Population Prospects 2024, period e0 (LEx), both sexes"
    },
    "sources": [
      {
        "field": "age_band",
        "producer": "UN DESA Population Division, World Population Prospects 2024",
        "year": 2023,
        "url": "https://population.un.org/wpp/assets/Excel%20Files/1_Indicator%20(Standard)/CSV_FILES/WPP2024_PopulationBySingleAgeSex_Medium_1950-2023.csv.gz",
        "license": "CC BY 3.0 IGO"
      },
      {
        "field": "sex",
        "producer": "UN DESA Population Division, World Population Prospects 2024",
        "year": 2023,
        "url": "https://population.un.org/wpp/assets/Excel%20Files/1_Indicator%20(Standard)/CSV_FILES/WPP2024_PopulationBySingleAgeSex_Medium_1950-2023.csv.gz",
        "license": "CC BY 3.0 IGO"
      },
      {
        "field": "country_iso3",
        "producer": "UN DESA Population Division, World Population Prospects 2024",
        "year": 2024,
        "url": "https://population.un.org/wpp/assets/Excel%20Files/1_Indicator%20(Standard)/CSV_FILES/WPP2024_PopulationBySingleAgeSex_Medium_1950-2023.csv.gz",
        "license": "CC BY 3.0 IGO"
      },
      {
        "field": "urban_rural",
        "producer": "UN DESA Population Division, World Urbanization Prospects 2025 (DEGURBA)",
        "year": 2025,
        "url": "https://population.un.org/wup/assets/Download/Countries%20and%20Aggregates/WUP2025-F02-Degree-of-Urbanization_percPop_by_category.xlsx",
        "license": "CC BY 3.0 IGO"
      },
      {
        "field": "income_or_consumption_ppp_band",
        "producer": "World Bank PIP income survey (national, 2021 PPP $3 / $4.20 / $8.30)",
        "year": 2023,
        "url": "https://api.worldbank.org/pip/v1/pip?country=BRA&year=2023&povline=3&format=json",
        "license": "CC-BY 4.0"
      },
      {
        "field": "education",
        "producer": "UNESCO Institute for Statistics",
        "year": 2023,
        "url": "https://api.uis.unesco.org/api/public/data/indicators",
        "license": "CC BY-SA 4.0"
      },
      {
        "field": "occupation_class",
        "producer": "ILO / ILOSTAT modelled estimates, Nov. 2025",
        "year": 2025,
        "url": "https://rplumber.ilo.org/data/indicator/?id=EAP_2WAP_SEX_AGE_RT_A&type=label&format=.csv",
        "license": "CC BY 4.0"
      },
      {
        "field": "family",
        "producer": "UN DESA Population Division, Database on Household Size and Composition 2026",
        "year": 2022,
        "url": "https://population.un.org/Household/assets/UNDESA_PD_2026_hh-size-composition.xlsx",
        "license": "CC BY 3.0 IGO"
      },
      {
        "field": "housing_energy_water_internet.electricity",
        "producer": "World Bank WDI EG.ELC.ACCS.ZS",
        "year": 2024,